title,link,snippet
Industrial irradiation facilities around the world | IAEA,https://www.iaea.org/newscenter/news/where-can-you-find-industrial-irradiation-facilities-visit-a-new-online-database,"Dec 15, 2020 ... The IAEA has recently published its updated Database on Industrial Irradiation Facilities (DIIF), featuring an interactive map with ..."
APHIS Certified Irradiation Treatment Facilities in the United States,https://www.aphis.usda.gov/import_export/plants/manuals/ports/downloads/aphis-certified-irradiation-facilities.pdf,"Jul 1, 2022 ... Facility Name. City. State Phone. Website. Calavo Grower's, Inc. 1. Hawaii Pride. Keaau. HI. 808-982-8880. Paina Hawaii 1."
"Radiation Safety of Gamma, Electron and X Ray Irradiation Facilities ...",https://www.iaea.org/publications/8401/radiation-safety-of-gamma-electron-and-x-ray-irradiation-facilities,... Guide provides recommendations on how to meet the requirements of the IAEA International Basic Safety Standards with regard to irradiation facilities.
Irradiation Facilities | Radiation Center | Oregon State University,https://radiationcenter.oregonstate.edu/content/irradiation-facilities,A number of irradiation facilities are available at the Radiation Center as a part of the Oregon State TRIGA reactor. Rotating Rack (Lazy Susan)Pneumantic ...
Food irradiation - Wikipedia,https://en.wikipedia.org/wiki/Food_irradiation,"In the case of large research or contract irradiation facilities, major capital costs include a radiation source, hardware (irradiator, totes and conveyors, ..."
Irradiation Facilities and Irradiation Methods for High Power Target,https://arxiv.org/abs/2203.08239,"Mar 15, 2022 ... Irradiation facilities and alternative methods are critical to provide a full support of material R&D and better address these critical ..."
List of approved facilities for the treatment of foods and food ...,https://eur-lex.europa.eu/legal-content/EN/TXT/PDF/?uri=CELEX:52016XC1104(01)&from=PL,"Nov 4, 2016 ... Approved irradiation facilities. Source. Reference No,. Name. Address. Further details of approval. AT. None. BE."
Irradiation Treatment; Location of Facilities in the ... - Federal Register,https://www.federalregister.gov/documents/2012/07/20/2012-17725/irradiation-treatment-location-of-facilities-in-the-southern-united-states,"Jul 20, 2012 ... The regulations do allow irradiation facilities to be located at the maritime ports of Gulfport, MS, and Wilmington, NC, and the airport of ..."
Experimental determination of proton hardness factors at several ...,https://iopscience.iop.org/article/10.1088/1748-0221/14/12/P12004,"Experimental determination of proton hardness factors at several irradiation facilities. P. Allport1, F. Bögelspacher3, K. Bruce1, R. Canavan1, A. Dierlamm3 ..."
Computational analysis of the dose rates at JSI TRIGA reactor ...,https://pubmed.ncbi.nlm.nih.gov/28965017/,Computational analysis of the dose rates at JSI TRIGA reactor irradiation facilities. Appl Radiat Isot. 2017 Dec;130:140-152. doi: ...
Computational analysis of irradiation facilities at the JSI TRIGA reactor,https://www.sciencedirect.com/science/article/pii/S0969804311005963,Accurate and reliable information on neutron flux and spectra in irradiation facilities is one of the key factors for performing good research work. The main ...
Pages - Welcome to DIIF Portal,https://nucleus.iaea.org/sites/diif/Pages/Home.aspx,"The database irradiation facilities are classified according to geographical region, country, machine type and beam energy range, or Co-60 activity, uses, ..."
Shielding Aspects of Accelerators ... - Nuclear Energy Agency (NEA),https://www.oecd-nea.org/jcms/pl_62971/shielding-aspects-of-accelerators-targets-and-irradiation-facilities-satif-14,"Dec 16, 2021 ... Shielding Aspects of Accelerators, Targets and Irradiation Facilities (SATIF-14). NEA/NSC/R(2021)2. Adobe Acrobat PDF Document - on 2/16/23 ..."
KM X-ray irradiation facilities | Karolinska Institutet,https://ki.se/en/km/km-x-ray-irradiation-facilities,"Jan 20, 2023 ... KM X-ray irradiation facilities ... The Xstrahl CIX3 is an X-ray cabinet for irradiation of small animals, at KM-A/KM-B/KM-F. X- ..."
SATIF-15: 15th workshop on ... - Nuclear Energy Agency (NEA),https://www.oecd-nea.org/jcms/pl_61651/satif-15-15th-workshop-on-shielding-aspects-of-accelerators-targets-and-irradiation-facilities-satif,"The 15th workshop on Shielding aspects of Accelerators, Targets, and Irradiation Facilities (SATIF) is tentatively planned to be held in East Lansing, ..."
Radiation Safety of Gamma and Electron Irradiation Facilities,https://inis.iaea.org/collection/NCLCollectionStore/_Public/23/063/23063424.pdf,"Radiation safety of gamma and electron irradiation facilities. — Vienna : Inter- national Atomic Energy Agency, 1992. p. ; 24 cm. - (Safety series, ISSN 0074- ..."
Irradiation facilities - TUM FRMII,https://www.frm2.tum.de/en/frm2/the-neutron-source/irradiation-facilities/,"Irradiation facilities. View of the reactor pool and its irradiation facilities. (Photo: Eckert/Heddergott, TUM). The fission of uranium initially supplies ..."
NSUF: Home Page,https://nsuf.inl.gov/,The NSUF offers researchers access to best-in-class gamma irradiation facilities. Reactors. The NSUF offers ten reactor facilities to users whose proposals are ...
AIDA-2020 Poster Irradiation Facilities at CERN,https://cds.cern.ch/record/2288578/files/AIDA-2020-POSTER-2017-004.pdf,"Irradiation Facilities at CERN. Gkotse, B. (CERN) et al. 04 October 2017. The AIDA-2020 Advanced European Infrastructures for Detectors at Accelerators ..."
Irradiation Facilities at CERN | IEEE Conference Publication | IEEE ...,https://ieeexplore.ieee.org/document/8696163,"CERN provides unique irradiation facilities for applications in many scientific fields. This paper summarizes the facilities currently operating for proton, ..."
Irradiation Facilities at CERN | IEEE Conference Publication | IEEE ...,https://ieeexplore.ieee.org/document/8696163,"CERN provides unique irradiation facilities for applications in many scientific fields. This paper summarizes the facilities currently operating for proton, ..."
Penn State Engineering: Co60 Gamma Ray Irradiation,https://www.rsec.psu.edu/Co60_Gamma_Ray_Irradiation.aspx,"The Radiation Science and Engineering Center has two gamma-ray irradiation facilities, which provide flexibility for research and industry projects."
arXiv: Experimental Determination of Proton Hardness Factors at ...,https://cds.cern.ch/record/2687706?ln=en,"Aug 28, 2019 ... Title, Experimental Determination of Proton Hardness Factors at Several Irradiation Facilities. Author(s), Allport, P. (Birmingham U.) ..."
7 CFR 305.9 -- Irradiation treatment requirements. - eCFR,https://www.ecfr.gov/current/title-7/subtitle-B/chapter-III/part-305/section-305.9,"For irradiation facilities located in the States of Alabama, Arizona, California, Florida, Georgia, Kentucky, Louisiana, Mississippi, Nevada, New Mexico, North ..."
Hydraulic Irradiation Facilities (Whale Tubes) – University of ...,https://reactor.engr.wisc.edu/hydraulic-irradiation-facilities-whale-tubes/,Hydraulic Irradiation Facilities (Whale Tubes). Polyethylene bottles used in the hydraulic irradiation tubes. Two right bottles are for the samples.
"Radiation Safety of Gamma, Electron and X Ray Irradiation Facilities",https://www-pub.iaea.org/mtcd/publications/pdf/pub1454_web.pdf,X RAY IRRADIATION FACILITIES. Safety standards survey. The IAEA welcomes your response. Please see: http://www-ns.iaea.org/standards/feedback.htm ...
"Neutron irradiation facilities, neutron measurement system, and ...",https://link.springer.com/article/10.1007/s40042-023-00713-0,"Jan 12, 2023 ... Neutron calibration facilities at KRISS include neutron irradiation facilities and neutron sources, such as radioactive isotope neutron ..."
Maps of nuclear facilities - Canadian Nuclear Safety Commission,https://nuclearsafety.gc.ca/eng/resources/maps-of-nuclear-facilities/results.cfm?category=processing-and-fuel-fabrication-facilities,"Feb 3, 2014 ... Radioactive waste management · Irradiation facilities · Medical facilities · Isotope producers. To navigate, press the arrow keys."
ISO/ASTM 51204:2004 - Practice for dosimetry in gamma irradiation ...,https://www.iso.org/standard/39030.html,Practice for dosimetry in gamma irradiation facilities for food processing. Abstract. ISO/ASTM 51204:2004 outlines the installation qualification program for ...
Automated application of low energy electron irradiation enables ...,https://www.nature.com/articles/s41598-020-69347-7,"Jul 30, 2020 ... Ionizing irradiation facilities therefore require a separated irradiation compartment surrounded by a combination of heavy lead shielding ..."
Irradiation Facilities | ep-dep-dt.web.cern.ch,https://ep-dep-dt.web.cern.ch/irradiation-facilities,"Irradiation Facilities. New Homepage : ps-irrad.web.cern.ch. A Few Words from our Team Irradiation. The IRRAD facilities will be closed during LS2, ..."
Accelerator Laboratory | Texas A&M University Engineering,https://engineering.tamu.edu/nuclear/research/facilities/accelerator-laboratory.html,The Accelerator Laboratory is one of the largest university ion irradiation facilities in the U.S. A total of five accelerators are able to deliver ...
CERN irradiation facilities supporting collider programs and targetry ...,https://indico.fnal.gov/event/48628/contributions/212413/attachments/144602/183760/MCa__Snowmass_Irradiation_CERN_talk_18Jun2021.pdf,"Jun 18, 2021 ... What is the role of irradiation facilities at CERN. ▫ Irradiation facilities supporting Beam Intercepting Devices (BIDs) and Target Systems."
Facilities // Notre Dame Radiation Laboratory // University of Notre ...,https://rad.nd.edu/facilities/,We offer access to unique irradiation facilities and opportunities for worldwide collaborative investigation. The unique constellation of experimental ...
Facilities,https://nrl.mit.edu/facilities,A short table of the representative dimensions and maximum flux levels for the neutron irradiation facilities is below. A summary of the MITR's experimental ...
Status of High Energy Irradiation Facilities in Europe,https://nepp.nasa.gov/workshops/dhesee2021/talks/4a_Status%20of%20High%20Energy%20Irradiation%20Facilities%20in%20Europe.pdf,A. Pesce/A. Costantino 19/04/2021| Slide 2. Facilities (worldwide from CERN database) https://irradiation-facilities.web.cern.ch/ ...
NEUTRON-IRRADIATION FACILITIES AT THE INTENSE PULSED ...,https://www.osti.gov/servlets/purl/6435785,"NEUTRON-IRRADIATION FACILITIES AT THE INTENSE PULSED-NEUTRON SOURCE*. K. C. Birtcher, T. R. Blewitt, M. A. Kirk,. T. L. Scott, B. S. Brown (PNS), and."
Irradiation Facilities of the Takasaki Advanced Radiation Research ...,https://www.mdpi.com/2412-382X/1/1/2,"The irradiation facilities of electron beam and the gamma-ray are also briefly outlined. 2. Overview of the Facilities. The configurations of TIARA, the ..."
In-Vessel Irradiation Experiment Facilities at HFIR | Neutron Science ...,https://neutrons.ornl.gov/hfir/in-vessel-irradiation,"The HFIR provides a variety of in-core irradiation facilities, allowing for a wide range of materials experiments and isotope production locations."
Phytosanitary Applications of Irradiation,https://www.ars.usda.gov/ARSUserFiles/30200530/pdf/10552_2011.pdf,cobalt-60 commercial irradiation facilities in tractor trailers were developed to irradiate commodities at remote locations (Guerreo.
In-Vessel Irradiation Experiment Facilities at HFIR | Neutron Science ...,https://neutrons.ornl.gov/hfir/in-vessel-irradiation,"The HFIR provides a variety of in-core irradiation facilities, allowing for a wide range of materials experiments and isotope production locations."
Phytosanitary Applications of Irradiation,https://www.ars.usda.gov/ARSUserFiles/30200530/pdf/10552_2011.pdf,cobalt-60 commercial irradiation facilities in tractor trailers were developed to irradiate commodities at remote locations (Guerreo.
"G20060072 Enclosure - Fact Sheet, Commercial Irradiators.",https://www.nrc.gov/docs/ML0605/ML060520648.pdf,"irradiation facilities are required to properly clean up the site once they are permanently shut down. At that time, any remaining radioactive sources must ..."
Irradiation Facilities,https://pnri.dost.gov.ph/index.php/services/facilities/irradiation-services,"May 7, 2015 ... Irradiation Facilities · 1. reduction of microbial load or decontamination of spices, herbal products and dehydrated vegetables, and cosmetic raw ..."
Food Irradiation | US EPA,https://www.epa.gov/radtown/food-irradiation,"Dec 13, 2022 ... Owners and workers in irradiation facilities should follow all OSHA radiation protection rules . These rules protect workers from exposure ..."
HRD-90-118 Food Irradiation: Federal Requirements and Monitoring,https://www.gao.gov/assets/hrd-90-118.pdf,companies that are licensed and operating food irradiation facilities in the United States; and . state actions to restrict food irradiation.
Gamma Facilities | Research | UMass Lowell,https://www.uml.edu/research/radlab/gamma-facilities.aspx,"Configured to provide gamma dose rates over four orders of magnitude, the gamma irradiation facilities have been used extensively for food irradiation ..."
Irradiation insights - Food irradiation for Australian producers,https://www.agriculture.gov.au/sites/default/files/documents/irradiation-insights-food-irradiation-australian-producers.pdf,"Australia already has irradiation facilities in the north and south to help producers access treatment close to their growing source, and limit the movement of ..."
Irradiation Facilities · Indico,https://indico.cern.ch/category/1714/,Managers. Ilias Efthymiopoulos; Kate Ross; Lucie Linssen; Mar Capeans Garrido; Michael Moll. 20 events Working Group on Future CERN Irradiation Facilities.
Irradiation Facilities and Irradiation Methods for High Power Target,https://lss.fnal.gov/archive/2022/conf/fermilab-conf-22-124-ad.pdf,A lack of irradiation facilities dedicated to material science to better understand radiation damage for material relevant for target slows down this effort.
EXPERIENCES IN THE OPERATION OF FOOD IRRADIATION ...,https://ifst.onlinelibrary.wiley.com/doi/abs/10.1111/j.1745-4549.1978.tb00569.x,"EXPERIENCES IN THE OPERATION OF FOOD IRRADIATION FACILITIES. Th. GRÜNEWALD,. Th. GRÜNEWALD. Federal Research Centre for Nutrition Karlsruhe, FRG."
PULSTAR Reactor – Nuclear Reactor Program,https://nrp.ne.ncsu.edu/about/pulstar-reactor/,"... the core periphery, (see Figure #1 below)yielding high thermal neutron fluxes at the sample irradiation facilities and beamports (see Table #1 below)."
Research Reactor | Nuclear Reactor Laboratory,https://reactor.osu.edu/facilities/research-reactor,"The NRL features The Ohio State University Research Reactor (OSURR), a pool‑type reactor with multiple beam ports and dry tubes as irradiation facilities, ..."
Neutron Irradiation Facilities (NIF) Overview | TRIUMF : Canada's ...,https://www.triumf.ca/neutron-irradiation-facility,Neutron Irradiation Facilities (NIF) Overview. TRIUMF makes use of three separate locations to perform neutron irradiations. The TNF facility offers ...
Irradiation Decontamination of Postal Mail and High-Risk Luggage,https://www.nist.gov/document/mfdpub80pdf,"irradiation facilities, it was able to attest that they were fully capable of sanitizing the mail with the highest level of quality possible."
The Dangers of Food Irradiation Facilities Worldwide Provided by ...,https://www.citizen.org/wp-content/uploads/australialawsuit.pdf,"In irradiation facilities, food products are moved on a conveyor belt past a radiation source, where it is exposed to radioactive cobalt-60 or cesium-137, ..."
Gamma-ray Irradiation Facilities - 量子科学技術研究開発機構,https://www.qst.go.jp/site/taka-shisetsuka-e/33128.html,"Apr 1, 2022 ... The gamma-ray irradiation facilities consist of two buildings equipped with six irradiation cells. They covers a wide dose-rate range from ..."
Transnational Access,https://radnext.web.cern.ch/transnational-access/,Transnational Access to irradiation facilities is the cornerstone of the RADNEXT project. More than 6000 beam time hours are awarded during the four years ...
Irradiation Facilities,http://rd50.web.cern.ch/irradiation/irradiation.html,Please visit the CERN Facilities DB of Irradiation Facilities: www.cern.ch/irradiation-facilities ....an (outdated) list of facilities with special ...
Irradiation facilities - PTB.de,https://www.ptb.de/cms/en/ptb/fachabteilungen/abt6/fb-63/information/irradiation-facilities.html,Irradiation facilities · Irradiation facility for high-energy photons. A measuring assembly for the generation of protons with energies in the MeV range is used ...
Gamma Irradiation Systems - Nordion,https://www.nordion.com/products/irradiation-systems/,There are over 200 large-scale irradiation facilities in operation in 40 countries—and over 120 have been built by Nordion.
Irradiation Facilities with High-energy Protons / Neutrons / Gammas ...,https://kt.cern/success-stories/irradiation-facilities-high-energy-protons-neutrons-gammas,"The following CERN irradiation facilities will be part of CERN-ESA protocol on radiation testing: IRRAD (24 GeV/c proton beam), CERF (reference neutron ..."
NSQN Electronic Irradiation Facilities Accessible at ANSTO,https://www.ansto.gov.au/media/6108/download?inline,"Mar 7, 2023 ... The NSQN has significant irradiation facilities accessible through ANSTO to irradiate electronic chips for the space applications."
Joint iia/WINS Workshop on the Security of Gamma Irradiation ...,https://www.wins.org/event/7847/joint-iia-wins-workshop-on-the-security-of-gamma-irradiation-facilities,"The radiation processing industry, which includes gamma irradiation facilities, is mature, heavily regulated and has an exemplary safety and security record ..."
Irradiation Facilities and Irradiation Methods for High Power Target ...,https://ui.adsabs.harvard.edu/abs/2022arXiv220308239P/abstract,Irradiation facilities and alternative methods are critical to provide a full support of material R&D and better address these critical challenges.
Neutron irradiation facilities,https://www.tudelft.nl/en/faculty-of-applied-sciences/business/facilities/tu-delft-reactor-institute/services-consultancy/neutron-irradiation-facilities,The HOR has various neutron irradiation facilities installed. Most often used are the pneumatic systems (BP2 through BP4) for irradiations of a few minutes ...
Irradiation facilities at SCK·CEN for radiation tolerance assessment ...,https://adsabs.harvard.edu/full/2003ESASP.540..627F,"627 IRRADIATION FACILITIES AT SCK. ... SCK•CEN, the Belgian Nuclear Research Center, is operating different gamma irradiation facilities, with gamma dose ..."
CERN's irradiation facilities eye to the future | EP News,https://ep-news.web.cern.ch/content/cerns-irradiation-facilities-eye-future,"Jun 23, 2021 ... CERN currently provides two in-house irradiation facilities, IRRAD based on a high-energy proton beam and GIF++ exploiting a unique ..."
"Shielding Aspects of Accelerators, Target and Irradiation Facilities ...",https://www.oecd.org/officialdocuments/publicdisplaydocumentpdf/?cote=NEA/NSC/R(2018)2&docLanguage=En,"Dec 3, 2021 ... Accelerator and irradiation facilities represent a key capability in R&D, medical and industrial infrastructures and can be used in a wide range ..."
A Mathematical Approach to the Optimum Design of Gamma ...,https://www.tandfonline.com/doi/abs/10.1080/10256018608623582,"Aug 6, 2008 ... To solve the problem of the optimization of gamma irradiation facilities given by an objective function (throughput), which is to be ..."
"Shielding Aspects of Accelerators, Target and Irradiation Facilities ...",https://www.oecd.org/officialdocuments/publicdisplaydocumentpdf/?cote=NEA/NSC/R(2018)2&docLanguage=En,"Dec 3, 2021 ... Accelerator and irradiation facilities represent a key capability in R&D, medical and industrial infrastructures and can be used in a wide range ..."
A Mathematical Approach to the Optimum Design of Gamma ...,https://www.tandfonline.com/doi/abs/10.1080/10256018608623582,"Aug 6, 2008 ... To solve the problem of the optimization of gamma irradiation facilities given by an objective function (throughput), which is to be ..."
Food Irradiation Facilities in India (Part-3) - YouTube,https://www.youtube.com/watch?v=KFEnSm1nVNs,"Jan 7, 2019 ... Food Irradiation Facilities in India (Part-3) | Food Irradiation | Irradiated food | Food Technology | Food processing | Food science and ..."
"Delivery Request: Shielding Aspects of Accelerators, Targets and ...",https://www.oecd-ilibrary.org/shielding-aspects-of-accelerators-targets-and-irradiation-facilities-satif-7_5lgw9nwf9bxn.pdf?itemId=%2Fcontent%2Fpublication%2F9789264010437-en&mimeType=pdf,"OECD's dissemination platform for all published content - books, podcasts, serials and statistics."
New irradiation facilities for development of production methods of ...,https://juser.fz-juelich.de/record/885176,"Oct 2, 2020 ... New irradiation facilities for development of production methods of medical radionuclides at cyclotrons at Forschungszentrum Jülich."
New irradiation Facilities for Development of Production Methods of ...,https://juser.fz-juelich.de/record/824653,"Dec 7, 2016 ... New irradiation Facilities for Development of Production Methods of Medical Radionuclides at Various Cyclotrons at Forschungszentrum Jülich."
"Proceedings, 8th Meeting on Shielding Aspects of Accelerators ...",https://inspirehep.net/literature/1479110,"Proceedings, 8th Meeting on Shielding Aspects of Accelerators, Targets and Irradiation Facilities (SATIF-8) : Pohang, Korea, May 22-24, 2006."
Foodstuffs treated with ionising radiation,http://publications.europa.eu/resource/legissum/l21117.ENG,"Feb 28, 2018 ... Irradiation facilities must keep records for each source of ionising radiation showing the information specified (i.e. the nature and ..."
Reactor Structures With Testing Or Irradiation Facilities Patents and ...,https://patents.justia.com/patents-by-us-classification/376/340,Search for Reactor Structures With Testing Or Irradiation Facilities Patents and Patent Applications (Class 376/340) Filed with the USPTO.
POTENTIAL BR2 IRRADIATION TEST FACILITIES FOR GBR FUEL,http://aei.pitt.edu/91676/1/4803.pdf,A number of BR2 irradiation facilities have been presented which are or will be available for the in-pile testing of fuel pin or coated particle fissile ...
"Upgrades for the CERN EP Irradiation Facilities (IRRAD, Gif++) and ...",https://hal-mines-paristech.archives-ouvertes.fr/hal-03107380,"Finally, a comprehensive data model for irradiation experiments, pre-requisite for developing common software tools for the irradiation facilities community ..."
"Opinion | IN FOOD IRRADIATION, THE BENEFITS PREVAIL - The ...",https://www.nytimes.com/1984/03/19/opinion/l-in-food-irradiation-the-benefits-prevail-058351.html,"Mar 19, 1984 ... Irradiation facilities do not have to be installed everywhere in order to solve the problem. The fact that foods of different types can be ..."
The effects of irradiation on major histocampatibility complex ...,https://www.ncbi.nlm.nih.gov/pmc/articles/PMC7119745/,[PubMed] [Google Scholar]; North R.J. γ-Irradiation facilities the expression of adoptive immunity against established tumors by eliminating suppressor T ...
Application of an ultraminiature thermal neutron monitor for ...,https://www.ncbi.nlm.nih.gov/pmc/articles/PMC4380057/,"Jan 14, 2015 ... ... there are still very few available BNCT irradiation facilities. One possible solution to this would be accelerator-based neutron sources ..."
PARTREC irradiation facilities — the University of Groningen ...,https://research.rug.nl/en/activities/partrec-irradiation-facilities,"PARTREC irradiation facilities. Brandenburg, S. (Contributor). Damage and Repair in Cancer Development and Cancer Treatment (DARE)."
Supplementary Material for: International comparison exercise for ...,https://karger.figshare.com/articles/dataset/Supplementary_Material_for_International_comparison_exercise_for_biological_dosimetry_after_exposures_with_neutrons_performed_at_two_irradiation_facilities_as_part_of_the_BALANCE_project/22651414,"Apr 18, 2023 ... ... exercise for biological dosimetry after exposures with neutrons performed at two irradiation facilities as part of the BALANCE project."
DOE-ID NEPA CX DETERMINATION,https://www.id.energy.gov/nepa/DOE-ID-16-097.pdf,NSUF) post-irradiation facilities. The remaining un-irradiated specimens will be thermally aged at the University and subjected to.
Irradiation facilities benefit fruit exporters | VOV.VN,https://english.vov.vn/en/trade/irradiation-facilities-benefit-fruit-exporters-323804.vov,"Irradiation facilities benefit fruit exporters. Tuesday, 12:04, 28/06/2016. VOV.VN trên Google News. The provision of irradiation services for fresh fruit ..."
Increasing Positive Perceptions of Food Irradiation: Appealing to ...,https://archives.joe.org/joe/2008august/rb3.php,"Aug 11, 2008 ... The short course employed experiential components, such as tours of food irradiation facilities, group activities, and taste-tests of ..."
Proposed Rules,https://www.govinfo.gov/content/pkg/FR-1999-02-24/pdf/99-4401.pdf,"Feb 24, 1999 ... requirements for irradiation facilities promulgated by FSIS and other Federal and State agencies, such as requirements for dosimetry and."
Irradiation: Making Produce Healthy and Safe - Zahed - 2008 ...,https://ift.onlinelibrary.wiley.com/doi/full/10.1111/j.1541-4329.2007.00043.x,"Dec 17, 2007 ... Currently, no refrigerated irradiation facilities exist for produce, and there is a shortage of irradiation facilities in general."
