title,link,snippet
Plasma acceleration - Wikipedia,https://en.wikipedia.org/wiki/Plasma_acceleration,"For example, an experimental laser plasma accelerator at Lawrence Berkeley National Laboratory accelerates electrons to 1 GeV over about 3.3 cm (5.4x1020 ..."
Demonstration of a compact plasma accelerator powered by laser ...,https://www.nature.com/articles/s41467-021-23000-7,"May 17, 2021 ... Few femtosecond, few kiloampere electron bunch produced by a laser–plasma accelerator. Nat. Phys. 7, 219–222 (2011)."
Decoding Sources of Energy Variability in a Laser-Plasma Accelerator,https://link.aps.org/doi/10.1103/PhysRevX.10.031039,"Aug 18, 2020 ... Decoding Sources of Energy Variability in a Laser-Plasma Accelerator. Andreas R. Maier, Niels M. Delbos, Timo Eichner, Lars Hübner, ..."
A laser–plasma accelerator producing monoenergetic electron ...,https://www.nature.com/articles/nature02963,"Sep 30, 2004 ... A laser–plasma accelerator producing monoenergetic electron beams. J. Faure,; Y. Glinec, ..."
Optimal Beam Loading in a Laser-Plasma Accelerator,https://link.aps.org/doi/10.1103/PhysRevLett.126.174801,"Apr 26, 2021 ... Optimal Beam Loading in a Laser-Plasma Accelerator. Manuel Kirchen, Sören Jalas, Philipp Messner, Paul Winkler, Timo Eichner, Lars Hübner, ..."
Laser Plasma Accelerators: Background and Motivation,https://bella.lbl.gov/laser-plasma-accelerators-background-and-motivation/,"laser plasma accelerator cavity. 20 cm long laser plasma acceleration cavity. Accelerating structures: Traditional linacs use electric fields, ..."
"Low Emittance, High Brilliance Relativistic Electron Beams from a ...",https://link.aps.org/doi/10.1103/PhysRevLett.105.215007,"Nov 19, 2010 ... Low Emittance, High Brilliance Relativistic Electron Beams from a Laser-Plasma Accelerator. E. Brunetti, R. P. Shanks, G. G. Manahan, ..."
A laser-plasma accelerator producing monoenergetic electron beams,https://pubmed.ncbi.nlm.nih.gov/15457253/,A laser-plasma accelerator producing monoenergetic electron beams. Nature. 2004 Sep 30;431(7008):541-4. doi: 10.1038/nature02963.
Bayesian Optimization of a Laser-Plasma Accelerator,https://link.aps.org/doi/10.1103/PhysRevLett.126.104801,"Mar 11, 2021 ... Bayesian Optimization of a Laser-Plasma Accelerator. Sören Jalas, Manuel Kirchen, Philipp Messner, Paul Winkler, Lars Hübner, ..."
A laser-plasma accelerator driven by two-color relativistic ...,https://www.science.org/doi/10.1126/sciadv.aav7940,"Nov 22, 2019 ... A typical laser-plasma accelerator (LPA) is driven by a single, ultrarelativistic laser pulse from terawatt- or petawatt-class lasers."
High-charge relativistic electron bunches from a kHz laser-plasma ...,https://link.aps.org/doi/10.1103/PhysRevAccelBeams.21.013401,"Jan 29, 2018 ... High-charge relativistic electron bunches from a kHz laser-plasma accelerator. D. Gustas, D. Guénot, A. Vernier, S. Dutt, F. Böhle, ..."
A laser-plasma accelerator driven by two-color relativistic ...,https://pubmed.ncbi.nlm.nih.gov/31803828/,"Nov 22, 2019 ... A typical laser-plasma accelerator (LPA) is driven by a single, ultrarelativistic laser pulse from terawatt- or petawatt-class lasers."
Laser-plasma accelerator group | University of Oxford Department of ...,https://www.physics.ox.ac.uk/research/group/laser-plasma-accelerator-group,Laser-plasma accelerator group. Research group. Research theme. Accelerator physics · Lasers and high energy density science · Plasma physics. Sub ...
Observation of beam loading in a laser-plasma accelerator,https://arxiv.org/abs/0904.4763,"Apr 30, 2009 ... An experimental study conducted with a laser-plasma accelerator is presented. Beam loading manifests itself through the decrease of the beam ..."
Parametric emittance measurements of electron beams produced by ...,https://iopscience.iop.org/article/10.1088/1361-6587/aab6cd,"Parametric emittance measurements of electron beams produced by a laser plasma accelerator. S K Barber1 , J van Tilborg1, C B Schroeder1, R Lehe1, ..."
Berkeley Lab Laser Accelerator,https://atap.lbl.gov/berkeley-lab-laser-accelerator-bella/,"The laser-plasma accelerator (LPA) is a potentially revolutionary concept, now in its exciting early days, for making accelerators smaller and more ..."
"Coupling 2 'Tabletop' Laser-Plasma Accelerators, a Decisive First ...",https://newscenter.lbl.gov/2016/02/01/2-stage-laser-plasma-accelerator/,"Feb 1, 2016 ... An experiment at Berkeley Lab showed that a laser pulse can accelerate an electron beam and couple it to a second laser plasma accelerator."
Consortium sets out to build European laser plasma accelerator ...,https://physicsworld.com/a/consortium-sets-out-to-build-european-laser-plasma-accelerator/,"Apr 27, 2016 ... Accelerator physicists in five European countries are developing plans for the world's first high-energy laser plasma accelerator facility ..."
ECP's WarpX Team Successfully Models Promising Laser Plasma ...,https://www.exascaleproject.org/ecps-warpx-team-successfully-models-promising-laser-plasma-accelerator-technology/,"Nov 16, 2022 ... And this laser plasma accelerator currently offers the prospect of building much cheaper and much more compact accelerators than ..."
Single-shot electron radiography using a laser–plasma accelerator ...,https://www.ncbi.nlm.nih.gov/pmc/articles/PMC9908895/,"Feb 8, 2023 ... Contact and projection electron radiography of static targets was demonstrated using a laser–plasma accelerator driven by a kilojoule, ..."
Introduction to plasma wakefield acceleration,https://indico.cern.ch/event/758617/contributions/3146206/attachments/1751792/2838723/Wakefield_intro.pdf,why do we want to use a laser-plasma accelerator? ‣ Conventional particle accelerators are large and expensive machines. ‣ Plasma based accelerators are a.
Beam quality preservation studies in a laser-plasma accelerator with ...,https://www.sciencedirect.com/science/article/pii/S0168900218302146,"Nov 12, 2018 ... Beam quality preservation studies in a laser-plasma accelerator with external injection for EuPRAXIA. Author links open overlay panel"
Generation of GeV Electron Beam From a Laser-Plasma Accelerator ...,https://ieeexplore.ieee.org/document/8458154,"Sep 11, 2018 ... Generation of GeV Electron Beam From a Laser-Plasma Accelerator and Its Prospect as a Desktop Source of Energetic Positrons and Gamma Rays For ..."
Next generation laser plasma accelerator – Michigan Engineering ...,https://majors.engin.umich.edu/next-generation-laser-plasma-accelerator/,"Next generation laser plasma accelerator. July 1st, 2015 by Studio Pence | Posted in ECE | No Comments. Tags: Medical Imaging (ECE)."
Next generation laser plasma accelerator,https://ece.engin.umich.edu/stories/next-generation-laser-plasma-accelerator,"Next generation laser plasma accelerator. July 1, 2015. One of the most promising avenues for achieving new target levels of high peak intensity and high ..."
Compact Laser Plasma Accelerator at Peking University,https://accelconf.web.cern.ch/ipac2016/papers/wepmy011.pdf,"Compact LAser Plasma Accelerator (CLAPA), a novel accelerator based on the interaction of high intensity ul- trafast laser and plasmas, was recently built ..."
Laser-Plasma Accelerator Workshop 2019 (5-10 May 2019 ...,https://indico.physik.uni-muenchen.de/event/5/,The 2019 edition of the Laser-Plasma Accelerator Workshop (LPAW2019) is set to take place at the Mediterranean Institute for Life Sciences (MedILS) in Split ...
On the Cover of HPL: Optical control of transverse motion of ...,https://www.cambridge.org/core/blog/2023/06/09/on-the-cover-of-hpl-optical-control-of-transverse-motion-of-ionization-injected-electrons-in-a-laser-plasma-accelerator/,"Jun 9, 2023 ... On the Cover of HPL: Optical control of transverse motion of ionization injected electrons in a laser plasma accelerator."
Laser-plasma accelerator-based single-cycle attosecond undulator ...,https://link.springer.com/article/10.1007/s00340-018-6976-z,"May 25, 2018 ... Laser-plasma accelerator-based single-cycle attosecond undulator source. Z. Tibai,; Gy. Tóth, ..."
World record: Laser-plasma accelerator operates continuously for ...,https://www.laserfocusworld.com/lasers-sources/article/14182071/world-record-laserplasma-accelerator-operates-continuously-for-30-hours,"Aug 20, 2020 ... In the LUX laser-plasma accelerator, a strong laser pulse generates a plasma wave in nitrogen-doped hydrogen gas within a fine capillary by ..."
X-ray sources using a picosecond laser driven plasma accelerator ...,https://pubs.aip.org/aip/pop/article/26/8/083110/1059454/X-ray-sources-using-a-picosecond-laser-driven,"Aug 23, 2019 ... In this work, we show that by using a Laser plasma accelerator, it is possible to generate a broadband (0.01–1 MeV) hard x-ray source that ..."
Status of Laser Plasma Accelerator for VHEE-RT | SPIE Optics + ...,https://spie.org/optics-optoelectronics/presentation/Status-of-Laser-Plasma-Accelerator-for-VHEE-RT/11790-8,"In Y. Glinec [2] and T. Fuchs [3] works, similar studies with real electron beam parameters as those delivered by laser plasma accelerator, have confirmed ..."
"Miniature, High Strength Transport Line Design for Laser Plasma ...",https://inspirehep.net/files/13c9f64986e1d1874959616996218b24,"the Laser-Plasma Accelerator at the LBNL LOASIS Facil- ity”, in Proc. Free Electron Laser Conf. (FEL06), Berlin,. Germany, Aug. 2006, paper TUPPH055, p."
Plasma Accelerators,https://mpa.desy.de/,"The laser-plasma accelerator and the active plasma lens of the PLASMED X hard X-ray source. Credit: DESY, S. Bohlen."
Laser Wakefield Acceleration – Center for Ultrafast Optical Science,https://cuos.engin.umich.edu/researchgroups/hfs/research/laser-wakefield-acceleration/,"Malka “A laser-plasma accelerator producing monoenergetic electron beams”, Nature 431,541 (2004). 6. C. G. R. Geddes, Cs. Toth, J. van Tilborg, E. Esarey, C. B. ..."
Development of a kHz laser-plasma accelerator – Laboratoire d ...,https://loa.ensta-paris.fr/research/appli-research-group/development-of-a-khz-laser-plasma-accelerator/,"Development of a kHz laser-plasma accelerator · In a laser-plasma accelerators, a very intense laser pulse is focused into a gas and creates a fully ionized ..."
Laser-Plasma Accelerators for Future Colliders and Light Sources,https://uspas.fnal.gov/materials/11ODU/Laser-Plasma3.pdf,"Jan 17, 2011 ... Basic design of a laser-plasma accelerator: single-stage limited by laser energy laser. E z wake. • Laser pulse length determined by plasma ..."
World Record: Innovative Laser Plasma Accelerator Operates Right ...,https://scitechdaily.com/world-record-innovative-laser-plasma-accelerator-operates-right-around-the-clock/,"Aug 25, 2020 ... For the first time, a so-called laser plasma accelerator has run for more than a day while continuously producing electron beams."
Laser-Plasma Accelerator Developments in Japan,https://www.slac.stanford.edu/econf/C010630/papers/T803.PDF,"Laser-Plasma Accelerator Developments in Japan. Kazuhisa Nakajima. ∗. High Energy Accelerator Research Organization Ibaraki, Japan."
Energy Evolution of Electrons Measured Noninvasively - Physics,https://physics.aps.org/articles/v15/s170,"Dec 6, 2022 ... ... have demonstrated a noninvasive technique for measuring the energy evolution of an electron bunch inside a laser-plasma accelerator."
Tunable Laser Plasma Accelerator based on Longitudinal Density ...,https://www.osti.gov/biblio/1048931,"Jul 15, 2011 ... OSTI.GOV Journal Article: Tunable Laser Plasma Accelerator based on Longitudinal Density Tailoring. Title: Tunable Laser Plasma Accelerator ..."
Update on BELLA Center's Free-Electron Laser driven by a Laser ...,https://opg.optica.org/abstract.cfm?uri=CLEO_SI-2019-SF3I.1,"Technology to drive a free-electron laser with a compact laser-plasma accelerator is pursued. Recently we commissioned a new 5-Hz 100 TW laser, produced first ..."
Increasing the speed of laser-plasma accelerator | ENSTA Paris,https://www.ensta-paris.fr/en/increasing-speed-laser-plasma-accelerator,The experiment conducted at LOA on colorectal cancer cells demonstrated that the kilohertz laser-plasma accelerator was perfectly adapted to deliver a ...
2019:04 Dosimetry in environments surrounding a laser-plasma ...,https://www.stralsakerhetsmyndigheten.se/publikationer/rapporter/stralskydd/2019/201904/,2019:04 Dosimetry in environments surrounding a laser-plasma accelerator. SSM perspective. Background. Modern laser technology makes it possible to generate ...
MLS,http://mls.desy.de/,"We continue to operate the LUX laser-plasma accelerator and ANGUS drive laser. We support our experimental work with theoretical studies, particle-in-cell ..."
Laser-Plasma-Accelerator – Science Communication Lab,https://scicom-lab.com/project/laser-plasma-accelerator,"Laser-Plasma-Accelerator ... In laser-plasma acceleration, a strong laser pulse (red) generates a plasma wave (blue) in hydrogen gas by stripping electrons from ..."
Tuning curves for a laser-plasma accelerator,https://journals.aps.org/prab/abstract/10.1103/PhysRevAccelBeams.26.071302,"Jul 17, 2023 ... Tuning curves for a laser-plasma accelerator · S. Jalas, M. Kirchen, C. Braun, T. Eichner, J. B. Gonzalez, L. Hübner, T. Hülsenbusch, P. Messner, ..."
Progress towards a 1 GeV laser-plasma accelerator - NASA/ADS,https://ui.adsabs.harvard.edu/abs/2003APS..DPPLI2002L/abstract,"Recent experimental progress towards the realization of a 1 GeV laser-plasma accelerator will be discussed. The l'OASIS Group has a 12 TW, 45 fs, ..."
Synchrotron Radiation from a Laser Plasma Accelerator in the ...,https://aip.scitation.org/doi/abs/10.1063/1.3520311,"Nov 15, 2010 ... Synchrotron Radiation from a Laser Plasma Accelerator in the Bubble Regime. AIP Conference Proceedings 1299, ..."
GeV electron beams from a laser-plasma accelerator,https://escholarship.org/uc/item/8bz4j1dr,"GeV electron beams from a laser-plasma accelerator. 2008. Schroeder, C.B.;; Toth, Cs.;; Nagler, B.;; Gonsalves, A.J.;; Nakamura, K.;; Geddes, C.G.R.; ..."
METHOD FOR GENERATING ELECTRON BEAMS IN A HYBRID ...,https://app.dimensions.ai/details/patent/WO-2012177561-A3,METHOD FOR GENERATING ELECTRON BEAMS IN A HYBRID LASER-PLASMA ACCELERATOR. Application WO-2012177561-A3. Abstract. A method for testing the sensitivity of ...
[PDF] A laser–plasma accelerator producing monoenergetic ...,https://www.semanticscholar.org/paper/A-laser%E2%80%93plasma-accelerator-producing-monoenergetic-Faure-Glinec/9d7ae75cb7c9840af339abb68ce6d1cf7f3a36b2,"Sep 30, 2004 ... Laser–plasma accelerator: status and perspectives · V. Malka, J. Faure, Y. Glinec, A. Lifschitz. Physics. Philosophical Transactions of the ..."
Laser-plasma-accelerator's potential to radically transform space ...,https://pureportal.strath.ac.uk/en/publications/laser-plasma-accelerators-potential-to-radically-transform-space-,"Feb 1, 2014 ... Further increased communication between the laser-plasma-accelerator community and the space radiation community is highly desirable."
Characterisation of a laser plasma accelerator x-ray source size ...,https://strathprints.strath.ac.uk/68792/,"Jul 10, 2019 ... Characterisation of a laser plasma accelerator x-ray source size using a Kirkpatrick-Baez microscope. Shahzad, Mohammed and Reid, ..."
Demonstration of stable long-term operation of a kilohertz laser ...,https://research.tue.nl/en/publications/demonstration-of-stable-long-term-operation-of-a-kilohertz-laser-,"Sep 14, 2020 ... We report on the stable and continuous operation of a kilohertz laser-plasma accelerator. Electron bunches with 2.6 pC charge and 2.5 MeV ..."
Decoding Sources of Energy Variability in a Laser-Plasma Accelerator,https://bib-pubdb1.desy.de/record/442055/files/Maier_PhysRevX.10.031039.pdf?subformat=pdfa&version=1,"Aug 18, 2020 ... Unlike RF-based machines, a laser-plasma accelerator generates a new accelerating cavity with every shot. Thus,."
Interferometry for full temporal reconstruction of laser-plasma ...,https://hal.science/hal-02908769v1/file/2020_Labat_NJP%20%281%29.pdf,"Jul 29, 2020 ... laser-plasma accelerator-based seeded free electron lasers. M. Labat, S. Bielawski, A. Loulergue, Sébastien Corde, M.E. Couprie, E. Roussel."
"Low emittance, high brilliance relativistic electron beams from a ...",http://eprints.gla.ac.uk/80147/,"Sep 23, 2021 ... Low emittance, high brilliance relativistic electron beams from a laser-plasma accelerator. Brunetti, E. et al. (2010) Low emittance, high ..."
Controlled electron injection in a laser-plasma accelerator - Ecole ...,https://hal-polytechnique.archives-ouvertes.fr/hal-00502126,"Controlled electron injection in a laser-plasma accelerator. Plasma Physics and Controlled Fusion, IOP Publishing, 2007, 49 (12B), pp.B395."
Advanced Accelerator Concepts Workshop,https://www.bnl.gov/atf/Meetings/AAC04/laserplasmaaceleration.htm,"Such a laser-plasma accelerator stage requires a method for generating large amplitude plasma waves using laser pulses, a method for guiding laser pulses ..."
Low-emittance electron bunches from a laser-plasma accelerator ...,https://repository.gsi.de/record/64728/export/hr?ln=en,Home > Publications database > Low-emittance electron bunches from a laser-plasma accelerator measured using single-shot X-ray spectroscopy > RIS ...
Compact Particle Accelerator Sets World Record | Engineering.com,https://www.engineering.com/story/compact-particle-accelerator-sets-world-record,"Dec 9, 2014 ... The setup is known as a laser-plasma accelerator, an emerging class of particle accelerators that physicists believe can shrink traditional, ..."
Modelling a Laser- plasma accelerator driven FEL,https://indico.maxiv.lu.se/event/476/contributions/2139/,"Jun 25, 2018 ... In this modelling of a laser- plasma accelerator driven FEL many advantages are achieved. It has a high accelerating gradients and large ..."
