Linear particle accelerator - Wikipedia,https://en.wikipedia.org/wiki/Linear_particle_accelerator,"As linear accelerators were developed with higher beam currents, using magnetic fields to focus proton and heavy ion beams presented difficulties for the ..."
LINAC (Linear Accelerator),https://www.radiologyinfo.org/en/info/linac,Modern linear accelerators also have internal checking systems that do not allow the machine to be turned on unless all the prescribed treatment ...
Treatment Techniques: Linear Accelerators » Radiation Oncology ...,https://radonc.med.ufl.edu/patient-care/technologies-and-resources/treatment-techniques/,"At the University of Florida Davis Cancer Pavilion, a variety of medical linear accelerators (LINACs) are used to provide patients with external beam ..."
How Particle Accelerators Work | Department of Energy,https://www.energy.gov/articles/how-particle-accelerators-work,"Jun 18, 2014 ... Linear accelerators propel particles along a linear, or straight, beam line. Circular accelerators propel particles around a circular track."
RF Linear Accelerators | Wiley Online Books,https://onlinelibrary.wiley.com/doi/book/10.1002/9783527623426,"Jan 23, 2008 ... RF Linear Accelerators, Second Edition ; Online ISBN:9783527623426 | ; Author Bios. Thomas P. Wangler received his B.S. degree in physics from ..."
X-ray sources of medical linear accelerators: focal and extra-focal ...,https://pubmed.ncbi.nlm.nih.gov/8289724/,... (CT) reconstruction technique has been used to make quantitative measurements of the size and shape of the focal spot in medical linear accelerators.
Linear accelerators,https://arxiv.org/abs/1303.6766,Physics > Accelerator Physics. arXiv:1303.6766 (physics). [Submitted on 27 Mar 2013]. Title:Linear accelerators. Authors:Maurizio Vretenar.
Beam data modeling of linear accelerators (linacs) through machine ...,https://pubmed.ncbi.nlm.nih.gov/33039427/,Beam data modeling of linear accelerators (linacs) through machine learning and its potential applications in fast and robust linac commissioning and quality ...
Radiation Therapy | Products | Linear Accelerators | Elekta,https://www.elekta.com/products/radiation-therapy/,"Elekta's digital linear accelerators & positioning products offer precision radiotherapy treatment. GRT, IMRT, VMAT, SBRT & SRT. Learn more & enquire today."
Bunch shaping in electron linear accelerators,https://link.aps.org/doi/10.1103/RevModPhys.94.025006,"May 31, 2022 ... Modern electron linear accelerators are often designed to produce smooth bunch distributions characterized by their macroscopic ..."
A model for preemptive maintenance of medical linear accelerators ...,https://www.ncbi.nlm.nih.gov/pmc/articles/PMC4787012/,"Mar 10, 2016 ... Medical electron linear accelerators have continued to evolve since their development in the late 1950's at Stanford University [1]."
"RF Linear Accelerators: Wangler, Thomas P.: 9783527406807 ...",https://www.amazon.com/RF-Linear-Accelerators-Thomas-Wangler/dp/3527406808,RF Linear Accelerators is a textbook that is based on a US Particle Accelerator School graduate-level course that fills the need for a single introductory ...
MRI-LINAC: Magnetic Resonance Imaging Guided Linear Accelerator,https://www.brighamandwomens.org/radiation-oncology/mri-guided-linear-accelerator,... to traditional linear accelerators which use x-ray-based imaging to visualize the target area and adjacent anatomy for treatment setup and delivery.
Dosimetric analysis of beam-matching procedure of two similar ...,https://www.ncbi.nlm.nih.gov/pmc/articles/PMC3159224/,Linear accelerators from the same vendor in a radiation therapy center are usually beam-matched following Vendor's acceptance criteria.
DESIGN OF X-RAY TARGETS FOR HIGH ENERGY LINEAR ...,https://www.ajronline.org/doi/10.2214/ajr.121.4.873,DESIGN OF X-RAY TARGETS FOR HIGH ENERGY LINEAR ACCELERATORS IN RADIOTHERAPY ... ABSTRACT : The 25 MeV electron beam was extracted from a Varian Clinac-35 linear ...
A neutron track etch detector for electron linear accelerators in ...,https://www.ncbi.nlm.nih.gov/pmc/articles/PMC3423670/,"Electron linear accelerators in medical radiotherapy have replaced cobalt and caesium sources of radiation. However, medical accelerators with photon ..."
Cooling Particle Accelerators: Linear Accelerators and Cyclotrons ...,https://lairdthermal.com/thermal-technical-library/white-papers/cooling-particle-accelerators-linear-accelerators-and-cyclotrons,"Cooling Particle Accelerators: Linear Accelerators and Cyclotrons. Introduction. Particle accelerators, such as linear accelerator (LINAC) and cyclotron systems ..."
Is Africa a 'Graveyard' for Linear Accelerators? - ScienceDirect,https://www.sciencedirect.com/science/article/pii/S0936655516302734,"Clinical linear accelerators (LINACs) are the battle horses of many radiation therapy facilities around the globe [1]. When no back-up is available, ..."
"Linear Accelerators for Radiation Therapy | David Greene, P.C ...",https://www.taylorfrancis.com/books/mono/10.1201/9780429246562/linear-accelerators-radiation-therapy-david-greene-williams,"Sep 30, 2017 ... Linear Accelerators for Radiation Therapy, Second Edition focuses on the fundamentals of accelerator systems, explaining the underlying ..."
Linear Accelerator Treatments - Radiation Oncology,https://med.virginia.edu/radiation-oncology/about/advanced-technologies/linear-accelerator-treatments/,"Linear Accelerators, also known as linacs, are devices used to treat cancer. They are most commonly used for external beam radiation treatments."
Refurbished & Used Linear Accelerators | Radiology Oncology ...,https://www.oncologysystems.com/medical-equipment/radiation-therapy/linear-accelerators,Linear accelerators (Linacs) are essential to a radiation oncology practice and are used to treat tens of thousands of cancer patients every day.
Asymptotic Theory of Beam Break‐Up in Linear Accelerators ...,https://aip.scitation.org/doi/10.1063/1.1683315,"The phenomenon of radial beam break‐up observed in terms of long, multi‐section electron linear accelerators has been analyzed using a multi‐cavity model."
"Senior Linear Accelerators Engineer, Radiation Oncology job at UT ...",https://jobs.utsouthwestern.edu/job/17481972/senior-linear-accelerators-engineer-radiation-oncology/,"Discover Senior Linear Accelerators Engineer, Radiation Oncology and other Skilled Trade/Facilities Mgmt. jobs in Dallas, TX and apply online today!"
Radiological Safety Aspects of the Operation of Electron Linear ...,https://www-pub.iaea.org/mtcd/publications/pdf/trs188_web.pdf,Electron linear accelerators are being used throughout the world in increasing numbers in a variety of important applications. Foremost among these is their ...
Cutting-edge MRI-guided radiation therapy provides real-time view ...,https://www.mdanderson.org/publications/cancer-frontline/2019/collaboration-leads-to-fda-approval-of-cutting-edge-radiation-tr.html,"Jan 4, 2019 ... Linear accelerators have advanced to deliver high-precision radiation treatment to the tumor. Until recently, extra imaging meant additional ..."
Linear Accelerators: How do they work? | E-Gallery | University of ...,https://www.unmc.edu/elearning/egallery/linear-accelerators-how-do-they-work/,"Apr 11, 2022 ... Home — Office of Interactive E-Learning — E-Gallery — Linear Accelerators: How do they work? Linear ..."
"Linear accelerators for high energies: Physics Today: Vol 16, No 1",https://physicstoday.scitation.org/doi/10.1063/1.3050712,"Radar developments during World War II resulted in production of the necessary megawatt oscillators or amplifiers, and linear accelerators, both for ..."
Shielding Design Methods for Linear Accelerators,https://www.aapm.org/meetings/amos2/pdf/42-11997-3239-469.pdf,"Linear Accelerators. ▫ Preferable to assume full 450 Gy/wk workload is at the higher energy. – Simpler, more conservative calculation."
BRIEF-Québec To Acquire 12 Elekta Versa HD Linear Accelerators ...,https://www.reuters.com/article/brief-qubec-to-acquire-12-elekta-versa-h/brief-qubec-to-acquire-12-elekta-versa-hd-linear-accelerators-to-meet-growing-need-for-advanced-cancer-care-idUKASN0002V3,"Feb 11, 2020 ... QUÉBEC TO ACQUIRE 12 ELEKTA VERSA HD LINEAR ACCELERATORS TO MEET GROWING NEED FOR ADVANCED CANCER CARE."
Intraoperative radiation therapy using mobile ... - AAPM Reports,https://www.aapm.org/pubs/reports/detail.asp?docid=93,"In both cases, this cancer treatment modality uses stationary linear accelerators. With the development of new technology, mobile linear accelerators have ..."
Justice Department Announces Its Intention to Block Varian Medical ...,https://www.justice.gov/archive/atr/public/press_releases/2000/6908.htm,"Nov 6, 2000 ... Linear accelerators are devices used to deliver high-energy radiation to shrink or destroy cancerous tumors within the body."
Calculation of for several small detectors and for two linear ...,https://aapm.onlinelibrary.wiley.com/doi/abs/10.1118/1.3660770,"Nov 17, 2011 ... ... of correction factors for several detectors in static small photon fields for two linear accelerators (linacs) and for several detec..."
Basics of RF Linear Accelerators,https://www.osti.gov/servlets/purl/1493927,"Basics of RF Linear Accelerators. Dave Schwellenbach. Nevada National Security Site. New Mexico Operations, Los Alamos. UNLV. March 21, 2018."
"What are the Differences Between Linear Accelerators, Cyclotrons ...",https://www.machinedesign.com/learning-resources/whats-the-difference-between/article/21832184/what-are-the-differences-between-linear-accelerators-cyclotrons-and-synchrotrons,"Feb 3, 2017 ... Linear accelerators (also called linacs), cyclotrons, and synchrotrons are some of the most complex and expensive tools ever built."
Linear Accelerators | Parkridge Health System,https://parkridgehealth.com/service/linear-accelerators,Linear Accelerators - The Sarah Cannon Cancer Center houses two high energy Varian linear accelerators that are used to treat patients with cancer.
Design and Principles of Linear Accelerators and Colliders ...,https://link.springer.com/chapter/10.1007/978-3-030-34245-6_7,"May 28, 2020 ... Linear accelerators (linacs) use alternating radiofrequency (RF) electromagnetic fields to accelerate charged particles in a straight line."
MEDICAL APPLICATIONS OF ELECTRON LINEAR ACCELERATORS,https://cds.cern.ch/record/399430/files/p229.pdf,Modern linear accelerators also allow us to apply electron beam therapy. Electron beam therapy is suitable for the treatment of.
Health Care Providers that Utilize Linear Accelerators - Provider ...,https://www.tn.gov/content/dam/tn/hsda/documents/linear-accelerators-address.pdf,Health Care Providers that Utilize Linear Accelerators - Provider Addresses (As of10/24/2022). County. Provider. Type. Provider. Address.
Register an accelerator unit (electron beam accelerators ...,https://www.mass.gov/how-to/register-an-accelerator-unit-electron-beam-accelerators-electrocurtains-and-ion-implanters,All linear accelerators must be registered with the Radiation Control Program.
New linear accelerators installed | Department of Radiation Oncology,https://medicine.uiowa.edu/radiationoncology/content/new-linear-accelerators-installed,Throughout 2015 and into 2017 the Department or Radiation Oncology will continue replacing their existing Siemens Oncor linear accelerators with Elekta ...
External Beam Radiation Therapy | Cancer Centers of Southwest OK,https://www.ccswok.com/external-beam-radiation-therapy/,Modern linear accelerators also have internal checking systems. These systems do not allow the machine to be turned on unless all the prescribed treatment ...
Products | Varian,https://www.varian.com/products,"Varian products. We're proud of our efforts to help millions of people worldwide in their fight against cancer. Thousands of Varian linear accelerators, ..."
Linear accelerator 2 | CERN,https://home.cern/science/accelerators/linear-accelerator-2,"Linear accelerators use radiofrequency cavities to charge cylindrical conductors. The protons pass through the conductors, which are alternately charged ..."
Linear Accelerators for Radiation Therapy - 2nd Edition - David Green,https://www.routledge.com/Linear-Accelerators-for-Radiation-Therapy/Greene-Williams/p/book/9780750304764,"Linear Accelerators for Radiation Therapy, Second Edition focuses on the fundamentals of accelerator systems, explaining the underlying physics and the ..."
Superconducting Splittable Quadrupole Magnet for Linear ...,https://ieeexplore.ieee.org/document/6082396,"Nov 16, 2011 ... A new superconducting quadrupole magnet for linear accelerators was fabricated at Fermilab. The magnet is designed to work inside a ..."
Additively manufactured copper components for linear accelerators ...,https://ifast-project.eu/news/announcement/physics/additively-manufactured-copper-components-linear-accelerators,"Nov 2, 2021 ... Additively manufactured copper components for linear accelerators. World first: Fraunhofer IWS, together with CERN, RTU and PoliMi, ..."
Valuation of Linear Accelerators - HealthCare Appraisers,https://healthcareappraisers.com/valuation-of-linear-accelerators/,"Feb 1, 2023 ... Linear Accelerators have been providing radiation therapy treatment to cancer patients for over 50 years. Technology has significantly ..."
Introduction to Electrodynamics for Microwave Linear Accelerators,https://uspas.fnal.gov/materials/14Knoxville/slac-pub-7802(1).pdf,"linear accelerators, starting with the underlying foundation in electrodynamics. We review Maxwell's equations, the. Lorentz force law, and the behavior of ..."
Linear Accelerators,http://hyperphysics.phy-astr.gsu.edu/hbase/Particles/linac.html,"Linear Accelerators. As long ago as 1928, R. Wideroe demonstrated that electrons could be accelerated through a tube by applying a radio frequency voltage ..."
BEAM MATCHING EVALUATION OF TWO SIMILAR LINEAR ...,https://academic.oup.com/rpd/article/199/4/347/6966029,"Jan 2, 2023 ... Abstract. To evaluate the beam-matching of two Siemens Primus medical linear accelerators (Linacs), the output factor (Sc,p), wedge factor, ..."
Design and fabrication of a Nano-based neutron shield for fast ...,https://ro-journal.biomedcentral.com/articles/10.1186/s13014-020-01551-1,"May 11, 2020 ... Photo-neutrons are produced at the head of the medical linear accelerators (linac) by the interaction of high-energy photons, and patients ..."
Density of linear accelerator units (per million population),https://www.who.int/data/gho/indicator-metadata-registry/imr-details/3003,"Number of linear accelerators units from the public and private sectors, per 1 000 000 population. Disaggregation: Provider type (public/private)."
Smashing Atoms for Peace: Using Linear Accelerators to Produce ...,https://www.belfercenter.org/sites/default/files/files/publication/smashingatomsforpeace.pdf,"Oct 3, 2013 ... Linear accelerators are emerging as a potential substitute for nuclear research reactors, for both medical isotope production and generating neu ..."
Two Design Options for Compact Linear Accelerators for High Flux ...,https://www.mdpi.com/2076-3417/12/1/386,"Dec 31, 2021 ... We describe and compare two optimized design options of RF linear accelerators with different resonant frequencies at 162.5 MHz (f0) and 325 ..."
Linear Accelerators Archives - Cancer Care,https://www.cmhc.org/cancer/tag/linear-accelerators/,"Apr 5, 2022 ... The advanced, high-precision Varian linear accelerators at CMMC will provide our radiation oncology team and patients with new options for ..."
Linear accelerators,http://iopscience.iop.org/article/10.1088/0034-4885/12/1/306/pdf,Linear accelerators. To cite this article: D W Fry and W Walkinshaw 1949 Rep. Prog. Phys. 12 102. View the article online for updates and enhancements.
Advances in X-Band and S-Band Linear Accelerators for Security ...,https://accelconf.web.cern.ch/p05/papers/foab002.pdf,"X-band linear accelerators for CT, producing high quality images of oil pipes and wood logs. An X-band linear accelerator head on a robotic arm has been ..."
Particle Accelerators and Radiation Research | US EPA,https://www.epa.gov/radtown/particle-accelerators-and-radiation-research,"Oct 17, 2022 ... Medical linear accelerators can fit inside a hospital room. Alternately, the largest particle accelerator in world, the Large Hadron ..."
Third generation linear accelerators: brief features : Journal of ...,https://journals.lww.com/jomp/Citation/1979/04020/Third_generation_linear_accelerators__brief.5.aspx,1979 Journal of Medical Physics | Published by Wolters Kluwer – Medknow. Source. Third generation linear accelerators: brief features.
Elekta Versa HD Linear Accelerators - Our Technology - Cancer ...,https://www.wkhs.com/cancer/technology/elekta-versa-hd-linear-accelerators,Elekta Versa HD Linear Accelerators. Among the options available for external beam radiation therapy (EBRT) at Willis-Knighton is the Elekta Versa HD linear ...
Vacuum in Linear Accelerators | Agilent,https://www.agilent.com/en/solutions/vacuum-solutions/particle-plasma-physics/linear-accelerators,"Linear accelerators, often called linacs, are a class of devices that use microwave energy to accelerate electrons to high energies."
Clinical Linear Accelerators | Oncology Medical Physics,https://oncologymedicalphysics.com/clinical-linear-accelerators/,Clinical Linear Accelerators · Design and Operating Principles · Dosimetry and Quality Assurance ...
Varian Linear Accelerators at Karmanos,https://www.mclaren.org/main/varian-linear-acceleration-karmanos,"Varian Linear Accelerators. The Karmanos Cancer Institute offers the Varian TrueBeam linear accelerator, a state-of-the-art image-guided radiation therapy ..."
"ICRU Report 97, MRI-Guided Radiation Therapy Using MRI-Linear ...",https://www.icru.org/report/icru-report-97-mri-guided-radiation-therapy-using-mri-linear-accelerators/,"MRI-guided Radiation Therapy (MRIgRT) using integrated MRI-Linear Accelerators, or MRI-linacs, is a rapidly advancing technology implemented in radiation ..."
Radiation Control | Radiation Control | Health & Senior Services,https://health.mo.gov/safety/radprotection/index.php,Routine radiology; Dental X-ray; Fluoroscopy; C.T.; Mammography; Linear Accelerators used in radiation therapy; Bone Density testing; Non-medical Industrial ...
CERN - #DidYouKnow linear accelerators are at the very... | By ...,https://www.facebook.com/cern/videos/didyouknow-linear-accelerators-are-at-the-very-core-of-cerns-accelerator-chain-a/299551471467196/,"Dec 19, 2020 ... DidYouKnow linear accelerators are at the very core of CERN's accelerator chain, as the main source for ion and proton beams?"
BRIEF-Québec To Acquire 12 Elekta Versa HD Linear Accelerators ...,https://www.reuters.com/article/brief-qubec-to-acquire-12-elekta-versa-h/brief-qubec-to-acquire-12-elekta-versa-hd-linear-accelerators-to-meet-growing-need-for-advanced-cancer-care-idUSASN0002V3,"Feb 11, 2020 ... Feb 11 (Reuters) - Elekta AB (publ):. * QUÉBEC TO ACQUIRE 12 ELEKTA VERSA HD LINEAR ACCELERATORS TO MEET GROWING NEED FOR ADVANCED CANCER ..."
Mobile Linear Accelerators for Intraoperative Radiation Therapy ...,https://aornjournal.onlinelibrary.wiley.com/doi/abs/10.1016/S0001-2092(06)61769-9,"Nov 1, 2001 ... Mobile Linear Accelerators for Intraoperative Radiation Therapy. A. Sam Beddar,. A. Sam Beddar. Search for more papers by this author."
Collimator-related radiation dose for different cobalt machines and ...,https://www.redjournal.org/article/0360-3016(96)00083-1/abstract,"Data were collected for four cobalt machines and 37 linear accelerators, from seven different manufacturers. All togetehr 56 datasets were collected for 12 ..."
Simulations of longitudinal instabilities in ion induction linear ...,https://www.cambridge.org/core/journals/laser-and-particle-beams/article/simulations-of-longitudinal-instabilities-in-ion-induction-linear-accelerators/31FEC64129CE8D9BA0B4A4F9BF252DEE,This article describes computer simulations of a longitudinal instability that affects induction linear accelerators for high-power ion beams.
AlignRT InBore | Advanced SGRT Solution for Halcyon® and Ethos ...,https://www.youtube.com/watch?v=Xfs8LgT1a5w,"Feb 20, 2023 ... AlignRT® InBore™ is an SGRT solution for use with Halcyon® and Ethos™ linear accelerators, enabling 6DoF intrafraction patient monitoring ..."
"CERN on Twitter: ""#DidYouKnow linear accelerators are at the very ...",https://twitter.com/CERN/status/1340207490403688448,"Dec 19, 2020 ... #DidYouKnow linear accelerators are at the very core of CERN's accelerator chain, as the main source for ion and proton beams?"
International Linear Collider,https://linearcollider.org/,"Consisting of two linear accelerators that will stretch approximately 20 kilometers in length, the ILC will smash electrons and their antimatter particles, ..."
Compact Superconducting Magnet for Linear Accelerators - INSPIRE,https://inspirehep.net/literature/1335599,New Linear Accelerators based on SCRF cavities need compact and efficient superconducting magnet packages to focus and steer electron or proton beams.
Experimental evidence of space charge driven resonances in high ...,https://inspirehep.net/literature/1455680,"Jan 12, 2016 ... Experimental studies of the space charge driven resonances of high intensity linear accelerators are rare as opposed to the multitude of ..."
Nonionizing Radiation Around Linear Accelerators: Applied ...,https://www.tandfonline.com/doi/abs/10.1080/1047322X.1995.10387686,"Feb 25, 2011 ... Two Varian linear accelerators, Clinac 1800 and Clinac 6X, were examined for different nonionizing radiation hazards."
Mitigation of envelope instability through fast acceleration in linear ...,https://escholarship.org/uc/item/83d30138,"Author(s): Qiang, J | Abstract: The space-charge driven envelope instability can be of great danger in high intensity accelerators. Linear accelerators were ..."
Pulse Shortening Effect in Linear Accelerators - NASA/ADS,https://ui.adsabs.harvard.edu/abs/1964JaJAP...3...27H/abstract,"Pulse Shortening Effect in Linear Accelerators. Hirakawa, Hiromasa. Abstract. The injection current into an electron linear accelerator has a threshold ..."
Proton and Ion Linear Accelerators,https://web.fnal.gov/services/USPAS/Materials/2021%20June%20Stony%20Brook%20U/Proton%20%26%20Ion%20Linear%20Accelerators/Lectures%20by%20Yuri%20Batygin/6.Acceleration_of_Intense_Beams_in_RF_Linacs.pdf?e=LPeIu2,"linear accelerators”, Harwood, 1985): transverse momentum longitudinal momentum deviation from synchronous particle deviation from synchronous particle."
Out-of-field doses and neutron dose equivalents for electron beams ...,https://scholars.uab.edu/display/pub2452594,... for electron beams from modern Varian and Elekta linear accelerators ... patient plane on both the Varian 21iX and Elekta Versa HD linear accelerators.
[PDF] High-gain free electron lasers using induction linear ...,https://www.semanticscholar.org/paper/High-gain-free-electron-lasers-using-induction-Orzechowski-Scharlemann/d81643f057efb59831c3a7c60c4f992d0f4af8ff,"Jul 1, 1985 ... High-power free electron lasers (FEL's) can be realized using induction linear accelerators as the source of the electron beam."
RF Linear Accelerators | An Introduction to the Physics of Particle ...,https://www.worldscientific.com/doi/abs/10.1142/9789814439633_0009,RF Linear Accelerators. https://doi.org/10.1142/9789814439633_0009Cited by:0. Previous · Next. About. Figures; References; Related; Details.
COURSE: RECIRCULATING LINEAR ACCELERATORS 1 ...,https://www.jlab.org/ERL/USPAS/USPAS_outline.pdf,"Feb 1, 2023 ... COURSE: RECIRCULATING LINEAR ACCELERATORS. 1. INTRODUCTION TO RECIRCULATING LINACS. • Properties of Linacs (GK 1 Feb.) • Why Recirculate?"
Long-term performance of linear accelerators,https://www.birpublications.org/doi/pdf/10.1259/0007-1285-58-690-556,It may be of some interest to give the results of a review of the performance of the first four linear accelerators installed at this hospital.
High Current Linear Accelerators.,https://apps.dtic.mil/sti/citations/ADA159832,*ELECTRON ACCELERATORS · *LINEAR ACCELERATORS · HIGH POWER · HIGH FREQUENCY · RECOVERY · CORES · DEGRADATION · ACCELERATION · EFFICIENCY · ENERGY GAPS ...
