title,link,snippet
https://indico.cern.ch/event/685255/contributions/...,https://indico.cern.ch/event/685255/contributions/2957993/attachments/1717945/2779840/CAS_Cyclotrons_I.pptx,"Sep 25, 2018 ... TRIUMF, RIKEN SRC, PSI Ring, PSI medical cyclotron. discussion. classification of circular accelerators, cyclotron vs."
Medicine: Pure but Practical - TIME,"https://content.time.com/time/magazine/article/0,9171,761656,00.html","A regular program of medical cyclotron work was set afoot, in charge of the inventor's brother, Dr. John Hundale Lawrence, who has a medical degree from ..."
Estimation of Thermal & Epithermal Neutron Flux and Gamma Dose ...,https://discovery.ucl.ac.uk/id/eprint/10126401/,Nisbet_Characterization of Neutron Flux in a Medical Cyclotron for Research Purposes using Gold foils and GATE8.1.pdf - Accepted Version
Preliminary evaluation of the enriched zinc-68 chloride solution ...,https://orbit.dtu.dk/en/publications/preliminary-evaluation-of-the-enriched-zinc-68-chloride-solution-,Preliminary evaluation of the enriched zinc-68 chloride solution target for the continuous production of gallium-68 chloride on a medical cyclotron.
Monograph on Cancer Research No. 20. Cancer Metastasis ...,https://www.nature.com/articles/bjc1978129.pdf,"the 4th Medical Cyclotron Users Conference,. Miami Beach, Florida, March 1976. It consists of 10 papers on ""Production Aspects"", 9 on."
